{
  "format": "ovdb-database/draft-1",
  "id": "https://demodb.dev/adventureworks/",
  "localId": "adventureworks",
  "serverId": "https://demodb.dev/ovdb",
  "serverDbBaseUrl": "https://demodb.dev/ovdb/db/adventureworks/",
  "title": "AdventureWorks OLTP",
  "description": "Microsoft AdventureWorks OLTP sample database with people, products, sales, purchasing, manufacturing, and inventory.",
  "homepage": "https://adventureworks.demodb.dev/",
  "apiUrl": "https://demodb.dev/ovdb/v1/databases/adventureworks",
  "capabilities": {
    "read": true,
    "query": true,
    "write": false
  },
  "deployment": {
    "engine": "sqlite",
    "url": "https://cloud.openvaultdb.com/ovdb/dbs/adventureworks",
    "discovery": "https://demodb.dev/.well-known/openvaultdb"
  },
  "model": {
    "id": "modelspec://github.com/demo-db/adventureworks/adventureworks",
    "url": "https://adventureworks.demodb.dev/model/adventureworks.modelspec.json",
    "hclUrl": "https://adventureworks.demodb.dev/model/adventureworks.modelspec.hcl"
  },
  "meaning": {
    "id": "meaning://github.com/demo-db/adventureworks",
    "url": "https://adventureworks.demodb.dev/model/adventureworks.meaning.yaml"
  },
  "publisher": {
    "name": "DemoDB",
    "url": "https://github.com/demo-db",
    "repository": "https://github.com/demo-db/adventureworks"
  },
  "provenance": {
    "repository": "https://github.com/microsoft/sql-server-samples",
    "revision": "beaab06ef72831089ca80e5355d65e661fd19b26",
    "path": "samples/databases/adventure-works/oltp-install-script/instawdb.sql",
    "sha256": "e0f352f0e3a28ff15158130c237a91d58f1b60fffa7f30d2c412b92df4065dfd",
    "license": "MIT",
    "notes": "Pinned Microsoft SQL Server Samples AdventureWorks OLTP installer and companion source files from commit beaab06ef72831089ca80e5355d65e661fd19b26. The source AWBuildVersion.csv identifies the installer fixture as SQL Server 2025 build 17.0.1000.3; the README says the script adapts to the installed SQL Server version, so this is the pinned source fixture rather than a claim about every generated server build. The converter imports all 68 BULK INSERT inputs plus the one-row AWBuildVersion.csv, preserving 759,240 seeded rows across 71 physical tables, source primary and foreign keys, 93 explicit indexes, and the inline unique constraint on Production.Document.rowguid. DatabaseLog and ErrorLog remain empty because the installer creates them for runtime audit/error events and supplies no static CSV. All 20 original SQL Server view definitions are retained in metadata/native-objects.json. Eleven straightforward relational views are translated into SQLite and their query results are rebuilt and checked; nine views using SQL Server-only XML, APPLY, or PIVOT constructs remain source-only, with no fabricated rows. SQL Server XML is stored as text; geography and hierarchyid serializations are stored as opaque BLOBs. Computed-column source expressions are retained in native metadata while the pinned CSV snapshot values are stored as ordinary SQLite columns. GETDATE defaults are frozen to the pinned build timestamp; SQL Server NEWID defaults remain in native metadata but are omitted from the static SQLite schema because SQLite only permits constant defaults, and seeded GUID values are preserved. SQL Server-only setup, triggers, stored procedures, query store, and optimized-locking behavior are not implemented. Fixed-width character data is preserved including padding; checks translate SQL Server trailing-space comparison and the source one-character LIKE range to equivalent SQLite expressions. Decimal, numeric, and money source strings are parsed as Python binary floats and stored with SQLite NUMERIC affinity; exact decimal scale and precision are not guaranteed, and this fixture makes no fixed-point MONEY claim. SQL Server collation and numeric behavior can differ. The converter checks the pinned source-file hashes, compares complete logical SQLite schema and row contents across rebuilds, and compares regenerated native SQL Server table/view metadata to the checked-in metadata file. SQLite file bytes may vary across SQLite library versions. JSON and SQLite preserve NULL; CSV represents NULL as an empty field, indistinguishable from empty text. BLOB values in JSON and CSV are base64 encoded. The full SQLite fixture is 125276160 bytes; static export delivery must preserve the full source without truncation and may use deterministic compressed chunks. The sha256 identifies the decoded SQLite fixture; source.inputSha256 identifies the compressed dataFile bytes."
  },
  "licences": {
    "data": "MIT",
    "model": "MIT",
    "meaning": "CC0-1.0"
  },
  "recordsets": [
    {
      "name": "dbo.DatabaseLog",
      "kind": "table",
      "description": "Audit table tracking all DDL changes made to the AdventureWorks database. Data is captured by the database trigger ddlDatabaseTriggerLog.",
      "rowCount": 0,
      "columns": [
        {
          "name": "DatabaseLogID",
          "type": "INTEGER",
          "nullable": false,
          "primaryKey": true,
          "primaryKeyPosition": 1,
          "defaultValue": null
        },
        {
          "name": "PostTime",
          "type": "TEXT",
          "nullable": false,
          "primaryKey": false,
          "primaryKeyPosition": null,
          "defaultValue": null
        },
        {
          "name": "DatabaseUser",
          "type": "TEXT",
          "nullable": false,
          "primaryKey": false,
          "primaryKeyPosition": null,
          "defaultValue": null
        },
        {
          "name": "Event",
          "type": "TEXT",
          "nullable": false,
          "primaryKey": false,
          "primaryKeyPosition": null,
          "defaultValue": null
        },
        {
          "name": "Schema",
          "type": "TEXT",
          "nullable": true,
          "primaryKey": false,
          "primaryKeyPosition": null,
          "defaultValue": null
        },
        {
          "name": "Object",
          "type": "TEXT",
          "nullable": true,
          "primaryKey": false,
          "primaryKeyPosition": null,
          "defaultValue": null
        },
        {
          "name": "TSQL",
          "type": "TEXT",
          "nullable": false,
          "primaryKey": false,
          "primaryKeyPosition": null,
          "defaultValue": null
        },
        {
          "name": "XmlEvent",
          "type": "TEXT",
          "nullable": false,
          "primaryKey": false,
          "primaryKeyPosition": null,
          "defaultValue": null
        }
      ],
      "primaryKey": [
        {
          "column": "DatabaseLogID",
          "position": 1
        }
      ],
      "foreignKeys": [],
      "modelEntity": "dbo_DatabaseLog"
    },
    {
      "name": "dbo.ErrorLog",
      "kind": "table",
      "description": "Audit table tracking errors in the the AdventureWorks database that are caught by the CATCH block of a TRY...CATCH construct. Data is inserted by stored procedure dbo.uspLogError when it is executed from inside the CATCH block of a TRY...CATCH construct.",
      "rowCount": 0,
      "columns": [
        {
          "name": "ErrorLogID",
          "type": "INTEGER",
          "nullable": false,
          "primaryKey": true,
          "primaryKeyPosition": 1,
          "defaultValue": null
        },
        {
          "name": "ErrorTime",
          "type": "TEXT",
          "nullable": false,
          "primaryKey": false,
          "primaryKeyPosition": null,
          "defaultValue": "'2025-11-14 12:13:16.797'"
        },
        {
          "name": "UserName",
          "type": "TEXT",
          "nullable": false,
          "primaryKey": false,
          "primaryKeyPosition": null,
          "defaultValue": null
        },
        {
          "name": "ErrorNumber",
          "type": "INTEGER",
          "nullable": false,
          "primaryKey": false,
          "primaryKeyPosition": null,
          "defaultValue": null
        },
        {
          "name": "ErrorSeverity",
          "type": "INTEGER",
          "nullable": true,
          "primaryKey": false,
          "primaryKeyPosition": null,
          "defaultValue": null
        },
        {
          "name": "ErrorState",
          "type": "INTEGER",
          "nullable": true,
          "primaryKey": false,
          "primaryKeyPosition": null,
          "defaultValue": null
        },
        {
          "name": "ErrorProcedure",
          "type": "TEXT",
          "nullable": true,
          "primaryKey": false,
          "primaryKeyPosition": null,
          "defaultValue": null
        },
        {
          "name": "ErrorLine",
          "type": "INTEGER",
          "nullable": true,
          "primaryKey": false,
          "primaryKeyPosition": null,
          "defaultValue": null
        },
        {
          "name": "ErrorMessage",
          "type": "TEXT",
          "nullable": false,
          "primaryKey": false,
          "primaryKeyPosition": null,
          "defaultValue": null
        }
      ],
      "primaryKey": [
        {
          "column": "ErrorLogID",
          "position": 1
        }
      ],
      "foreignKeys": [],
      "modelEntity": "dbo_ErrorLog"
    },
    {
      "name": "Person.Address",
      "kind": "table",
      "description": "Street address information for customers, employees, and vendors.",
      "rowCount": 19614,
      "columns": [
        {
          "name": "AddressID",
          "type": "INTEGER",
          "nullable": false,
          "primaryKey": true,
          "primaryKeyPosition": 1,
          "defaultValue": null
        },
        {
          "name": "AddressLine1",
          "type": "TEXT",
          "nullable": false,
          "primaryKey": false,
          "primaryKeyPosition": null,
          "defaultValue": null
        },
        {
          "name": "AddressLine2",
          "type": "TEXT",
          "nullable": true,